{
  "schema_version": 1,
  "generated_by": "End-Session/1.0.0",
  "generated_at": "2026-08-21T04:50:55Z",
  "producer": "claude",
  "author": null,
  "session": {
    "id": "2026-08-21T0449Z-reconcile-docs-and-first-capture",
    "topic_slug": "reconcile-docs-and-first-capture",
    "started_at": "2026-08-21T04:37:22Z",
    "ended_at": "2026-08-21T04:50:55Z",
    "duration_known": true,
    "duration_minutes": 11,
    "duration_source": "session_start_marker",
    "context_completeness": "complete",
    "operator_note": "First run of End-Session since the skill was written on 2026-07-29. AI-Memory/Inbox/ did not exist before this run and was created by Phase 1. Session work targeted Projects/classmind but is recorded under _platform per Phase 3 rule 6, because the base==head boundary (see warnings) left zero changed paths for attribution and no project input was supplied. ClassMind's own session log and progress.md entry for today were written by hand before this run and are commit 0e95642, not Phase 7 output."
  },
  "project": {
    "primary": "_platform",
    "primary_detection": "changed_path_attribution",
    "secondary": [],
    "secondary_reason": "Zero changed paths in range; no attribution possible. Phase 3 rule 6 fallback with no project input."
  },
  "repo": {
    "name": "CopyPasteLabs",
    "remote": "https://github.com/copypastelabs262/CopyPasteLabs.git",
    "branch": "master",
    "upstream": "origin/master",
    "ahead": 0,
    "behind": 0
  },
  "session_boundary": {
    "base": "0e956426e486ee9587ea4987eecac744d4f9f6c8",
    "base_short": "0e95642",
    "base_strategy": "upstream_merge_base",
    "base_source": null,
    "head": "0e956426e486ee9587ea4987eecac744d4f9f6c8",
    "head_short": "0e95642"
  },
  "commits": [],
  "changes": {
    "summary": {
      "modified": 0,
      "added": 0,
      "deleted": 0,
      "renamed": 0,
      "copied": 0,
      "total_files": 0,
      "insertions": 0,
      "deletions": 0
    },
    "files": []
  },
  "working_tree": {
    "clean": true,
    "uncommitted": [],
    "staged": [],
    "untracked": []
  },
  "diff": {
    "stored": true,
    "path": "changes.patch",
    "size_bytes": 0,
    "omitted_reason": null,
    "binary_files": [],
    "regenerate_command": "git diff 0e95642..0e95642"
  },
  "related_sessions": []
}
